{"baseline":{"aggregate_sha256":"334bbae68b531c30dd6b6fb2fb46d828a4f2efdf0d2ca5d906bcd5d21b3344d6","manifest":{"path":"baseline-source.json","sha256":"0bbcd65fe2f6819bebb1f94d3ec8678c7ddbb0a2c010d272abc894fa86a0aa19"},"origin_commit":"8263f09a0f119af63441e271603c389e88712b89","protocol":"v1"},"budgets":{"hard":{"max_calls":126,"max_total_tokens":7560000,"max_wall_seconds":113400},"pilot":{"calibration_max_total_tokens":10000,"calibration_max_wall_seconds":300,"max_calls":23,"max_total_tokens":1330000,"max_wall_seconds":20100}},"campaign_id":"create-loop-v1-v2-real-task-pilot-2026","candidate":{"aggregate_sha256":"3751017afddce5e8cde97e7cca7ea06451b214b172e58db73a41629f0497802e","manifest":{"path":"candidate-source.json","sha256":"0b4d27d6a071ca1623d62b6d1786d7e77585db34306e80b13d8a833830b89609"},"origin_commit":"8263f09a0f119af63441e271603c389e88712b89","protocol":"v2"},"cli_identities":{"calibration_reuses":"producer","producer":{"arch":"x86_64","binding":{"id":"codex-0.144.1-windows","path":"cli-identities/codex-0.144.1-windows.json","sha256":"066dfb2332989d4caad5d485c06337fdac4c636b71c27ae6a224574196886628"},"platform":"windows","reason":null,"status":"frozen","version":"0.144.1"},"reviewer":{"arch":"x86_64","binding":null,"platform":"linux","reason":"Linux Codex 0.144.1 payload is not locally available and downloads are not authorized.","status":"unresolved","version":"0.144.1"}},"evaluator_manifest":{"path":"pilot-evaluator-manifest.json","sha256":"ad108aea1d596a18586f79b5c5c046909b79868daae25829b54623dfae64a815"},"execution":{"adapter":{"path":"codex_exec_adapter.py","sha256":"5be259e3539cb7dedfb3b534397d0a1354582d37eadb0fecc0f39eaf85800fc3"},"model":"gpt-5.6-sol","network_boundary":{"binding":null,"reason":"No authenticated OS-enforced default-deny boundary currently limits the model process tree to the frozen provider endpoint; workspace-write and shared network namespaces are insufficient.","status":"unresolved"},"reasoning_effort":"ultra","scored_call_limit":{"max_total_tokens":60000,"max_wall_seconds":900},"tool_profile":{"id":"provider-workspace-no-publish","path":"tool-profiles/provider-workspace-no-publish.json","sha256":"23ac372ae88da20f9c78f1c3ed35707bf4d8c54577d46aa94b43500e20bdb0fd"},"workspace_seed":20260805},"formal_execution_enabled":false,"formal_experiment":{"execution_enabled":false,"independent_real_task_claim":false,"legacy_plan_path":"experiment_harness.py","planned_pairs":42,"planned_runs":84},"instrument_manifest":{"path":"instrument-manifest.json"},"measurement_policy":{"authoritative":["criterion results","false completion","effect safety","recovery usage","control writes","deliverable hashes","total usage","blind preference","severe regression"],"not_measured":["control_context_share","productive_work_share","first_high_value_action_seconds","unnecessary_user_interruptions"],"usd_cost":"not-measured"},"pilot":{"arm_count":12,"calibration_calls":1,"pair_count":6,"producer_episode_calls":18,"review_calls":4,"stop_after_report":true,"total_calls":23},"provider":{"id":"custom-zeo-responses-ultra","path":"provider-profiles/custom-zeo-responses.json","sha256":"8e9a5ee5712c9e74d0bb589a69d631e095a5a8f8304d8023ea49622468c2e9a8"},"registered_at":"2026-08-05T00:00:00Z","scenario_manifest":{"path":"pilot-scenarios.json","sha256":"bdb52fb6028a2f5e129fd8670a746b6d8fe46942dd9b2c287e6a1549281ef36c"},"schema_version":"1.0","status":"prospective","stop_rules":["Stop after the six-pair pilot report.","Keep formal_execution_enabled false until a separately authorized formal campaign completes."]}
